{
  "$schema": "http://json-schema.org/draft-07/schema#",
  "title": "ReceiptGroundTruth",
  "type": "object",
  "properties": {
    "bill_id": { "type": "string" },
    "restaurant_name": { "type": "string" },
    "items": {
      "type": "array",
      "items": {
        "type": "object",
        "properties": {
          "name": { "type": "string" },
          "quantity": { "type": "number" },
          "unit_price": { "type": "number" },
          "total_price": { "type": "number" }
        },
        "required": ["name", "total_price"]
      }
    },
    "subtotal": { "type": "number" },
    "tax": { "type": "number" },
    "cgst": { "type": "number" },
    "sgst": { "type": "number" },
    "service_charge": { "type": "number" },
    "discount": { "type": "number" },
    "other_charges": { "type": "number" },
    "total": { "type": "number" }
  },
  "required": ["restaurant_name", "items", "subtotal", "total"]
}
