{
  "bill_id": "bill_01",
  "restaurant_name": "Punjab Grill & Tavern",
  "items": [
    {
      "name": "Chicken Biryani",
      "quantity": 2.0,
      "unit_price": 320.0,
      "total_price": 640.0
    },
    {
      "name": "Paneer Butter Masala",
      "quantity": 1.0,
      "unit_price": 340.0,
      "total_price": 340.0
    },
    {
      "name": "Garlic Naan",
      "quantity": 4.0,
      "unit_price": 60.0,
      "total_price": 240.0
    },
    {
      "name": "Fresh Lime Soda",
      "quantity": 2.0,
      "unit_price": 80.0,
      "total_price": 160.0
    },
    {
      "name": "Gulab Jamun with Ice Cream",
      "quantity": 1.0,
      "unit_price": 120.0,
      "total_price": 120.0
    }
  ],
  "subtotal": 1500.0,
  "cgst": 37.5,
  "sgst": 37.5,
  "tax": 75.0,
  "service_charge": 150.0,
  "discount": 100.0,
  "other_charges": 0.0,
  "total": 1625.0
}
